Jogador; Inscricao; Contrato; N; Inicio; Nascimento; dt_inscricao; clube
Jogador; Inscricao; Contrato; N; Inicio; Nascimento; dt_inscricao; clube
Hugo da Silva Alcantara;  129560;  Vinculo Encerrado ;  65656;  21/11/1996;  28/07/1979;  21/11/1996 00:00:00; Atlético / PR
Magno Alves de Araujo;  120743;  Rescisão ;  223833;  ;  13/01/1976;  07/11/1996 00:00:00; Independente / SP
Magno Alves de Araujo;  120743;  Contrato Definitivo ;  236798;  01/11/1996;  13/01/1976;  01/11/1996 00:00:00; Valinhos / SP
Valni Barros Lopes Junior;  121886;  Rescisão ;  229103;  ;  12/07/1974;  01/11/1996 00:00:00; Maranhão / MA
