Jogador; Inscricao; Contrato; N; Inicio; Nascimento; dt_inscricao; clube
Jogador; Inscricao; Contrato; N; Inicio; Nascimento; dt_inscricao; clube
Jeovanio Rocha do Nascimento;  126193;  Contrato Definitivo ;  65326598;  27/10/1995;  11/11/1977;  27/10/1995 00:00:00; Atlético / GO
Jose Rogerio Antunes Estefane Junior;  157411;  Vinculo Encerrado ;  6284;  11/10/1995;  03/03/1980;  11/10/1995 00:00:00; Paraná / PR
Anderson da Silva;  135493;  Vinculo Encerrado ;  614340;  ;  02/02/1980;  11/10/1995 00:00:00; Figueirense / SC
Gilmar Serafim;  107923;  Contrato Emprestimo ;  202131;  01/10/1995;  09/04/1969;  10/10/1995 00:00:00; Paysandu / PA
Lenilson Batista de Jesus;  142996;  Vinculo Encerrado ;  142996;  06/10/1995;  01/05/1981;  06/10/1995 00:00:00; Sao Cristovão / BA
Luis Fabio de Freitas;  124422;  Contrato Emprestimo ;  208768;  01/10/1995;  08/03/1975;  01/10/1995 00:00:00; União Futebol Clube de Nova Fatima / PR
Juan Silveira dos Santos;  123816;  Contrato Definitivo ;  21458754;  01/10/1995;  01/02/1979;  01/10/1995 00:00:00; Flamengo / RJ
