Jogador; Inscricao; Contrato; N; Inicio; Nascimento; dt_inscricao; clube
Jogador; Inscricao; Contrato; N; Inicio; Nascimento; dt_inscricao; clube
Rubens Nelson Caldeira Junior;  119531;  Rescisão ;  199894;  ;  20/09/1974;  24/07/1995 00:00:00; Guarani / SP
Antonio Augusto Ribeiro Reis Junior;  121283;  Contrato Definitivo ;  ;  20/07/1995;  30/01/1975;  20/07/1995 00:00:00; Vasco da Gama / RJ
Rubens Nelson Caldeira Junior;  119531;  Contrato Definitivo ;  199894;  09/04/1995;  20/09/1974;  07/07/1995 00:00:00; Guarani / SP
Jorge Wagner Goes Conceicao;  137073;  Vinculo Encerrado ;  718954;  ;  17/11/1978;  04/07/1995 00:00:00; Bahia / BA
Adailton Bolzan Martins;  125026;  Vinculo Encerrado ;  580526;  03/07/1995;  24/01/1977;  03/07/1995 00:00:00; Palmeiras / SP
